{
  "$schema": "https://json-schema.org/draft/2020-12/schema",
  "$id": "https://privometry.dev/specs/release/v1/release.schema.json",
  "title": "Privometry release manifest v1",
  "description": "One edge release on one channel: its version and a download per OS and architecture. Delivered as the payload of a DSSE envelope (payloadType application/vnd.privometry.release+json) signed with a release key. privometry update installs a release only when the signature verifies, the manifest has not expired, the version is newer than the running one, and the download matches the size and SHA-256 here.",
  "type": "object",
  "required": ["schema", "version", "channel", "released_at", "expires_at", "artifacts"],
  "properties": {
    "schema": { "const": "privometry.release/v1" },
    "version": { "$ref": "../../common/v1/common.schema.json#/$defs/semver" },
    "channel": { "enum": ["stable", "beta"] },
    "released_at": { "$ref": "../../common/v1/common.schema.json#/$defs/timestamp" },
    "expires_at": {
      "$ref": "../../common/v1/common.schema.json#/$defs/timestamp",
      "description": "Devices refuse a manifest after this time, so a mirror cannot keep serving an old release forever. The publisher re-signs the manifest before it expires."
    },
    "notes_url": { "$ref": "../../common/v1/common.schema.json#/$defs/https_url" },
    "artifacts": {
      "type": "array",
      "minItems": 1,
      "items": { "$ref": "#/$defs/artifact" }
    },
    "ext": { "$ref": "../../common/v1/common.schema.json#/$defs/ext" }
  },
  "$defs": {
    "artifact": {
      "type": "object",
      "required": ["os", "arch", "url", "sha256", "size", "format", "binaries"],
      "properties": {
        "os": { "enum": ["macos", "linux", "windows"] },
        "arch": { "enum": ["amd64", "arm64"] },
        "url": { "$ref": "../../common/v1/common.schema.json#/$defs/https_url" },
        "sha256": { "$ref": "../../common/v1/common.schema.json#/$defs/sha256" },
        "size": { "type": "integer", "minimum": 1, "maximum": 536870912, "description": "Exact size of the download in bytes." },
        "format": { "enum": ["tar.gz", "zip"] },
        "binaries": {
          "type": "array",
          "minItems": 1,
          "uniqueItems": true,
          "items": { "enum": ["privometry", "privometryd", "privometry-hook", "privometry-mcp-shim"] },
          "description": "The executables in the archive, at its top level. Nothing else is extracted."
        }
      },
      "additionalProperties": false
    }
  },
  "additionalProperties": false
}
